[
  {
    "kpi": "abs_transaction_size_usd",
    "p_value": 350000000,
    "unit": "USD",
    "asof": "2025-09-09",
    "p_confidence": 0.49,
    "sources": [
      {
        "type": "rating_agency",
        "name": "KBRA",
        "url": "https://www.kbra.com/ratings/upst-abs-2025-3",
        "asof": "2025-09-09"
      },
      {
        "type": "issuer_pr",
        "name": "BusinessWire (Issuer PR)",
        "url": "https://www.businesswire.com/news/home/20250909000001/en/",
        "asof": "2025-09-09"
      }
    ],
    "note": "Provisional (non-EDGAR). Do not overwrite T1. 144A/Reg S示唆: 公募様式はEDGAR非開示の可能性。"
  },
  {
    "kpi": "abs_class_a_size_usd",
    "p_value": 280000000,
    "unit": "USD",
    "asof": "2025-09-09",
    "p_confidence": 0.28,
    "sources": [
      {
        "type": "rating_agency",
        "name": "S&P",
        "url": "https://www.spglobal.com/ratings/en/issuer/upst-abs-2025-3",
        "asof": "2025-09-09"
      }
    ],
    "note": "Provisional (non-EDGAR). Do not overwrite T1. 144A/Reg S示唆: 公募様式はEDGAR非開示の可能性。"
  },
  {
    "kpi": "forward_flow_fortress_agreement",
    "p_value": "Executed",
    "unit": "text",
    "asof": "2025-09-02",
    "p_confidence": 0.28,
    "sources": [
      {
        "type": "issuer_pr",
        "name": "GlobeNewswire",
        "url": "https://www.globenewswire.com/news-release/2025/09/02/0000001/",
        "asof": "2025-09-02"
      }
    ],
    "note": "Provisional (non-EDGAR). Do not overwrite T1. Forward-flow agreement with Fortress (unconfirmed)."
  }
]
